{
  "approval_posture": {
    "compliance_claims": "blocked_until_data_owner_review",
    "production_access": "blocked",
    "read_access": "allowed_after_data_owner_scope_review",
    "validation_review": "allowed",
    "write_access": "not_requested"
  },
  "blocked_claims": [
    {
      "claim": "Production access is broadly approved.",
      "reason": "Only a read-only validation review can move before data owner scope confirmation."
    },
    {
      "claim": "The agent may export rows or mutate dashboards.",
      "reason": "The request is read-only and does not include export, write, or dashboard mutation proof."
    }
  ],
  "data_scope": {
    "may_include": [
      "aggregate product usage metrics",
      "internal business metrics"
    ],
    "must_define_before_access": [
      "retention period",
      "logging policy",
      "allowed channel and repository list",
      "customer data handling boundary",
      "reviewer-owned deletion and rollback process"
    ]
  },
  "decision": {
    "question": "Should the read-only analytics agent get BigQuery and Looker access?",
    "raw_prompt": "Should this read-only analytics agent get BigQuery and Looker access? It will read aggregate product usage tables, inspect saved dashboards, and summarize internal business metrics. It must not export rows, change dashboards, or touch customer incident context.",
    "review_posture": "Approve a scoped read-only validation review after data owner scope confirmation.",
    "verdict": "Do not approve production access yet; allow read-only validation review."
  },
  "evidence_notes": [
    {
      "note": "No live vendor, policy, or workspace evidence was fetched in offline mode.",
      "source": "offline harness",
      "status": "deterministic"
    },
    {
      "note": "The public demo path prepares review packets and does not grant access.",
      "source": "safety contract",
      "status": "enforced_by_default"
    }
  ],
  "generated_by": "inferenceatlas-agent-demo",
  "missing_proof": [
    {
      "item": "BigQuery read-only allowlist and credential proof",
      "owner": "Data/Engineering",
      "unblocks": "read-only validation review"
    },
    {
      "item": "Looker read-only allowlist and credential proof",
      "owner": "Data/Engineering",
      "unblocks": "read-only validation review"
    },
    {
      "item": "Data owner confirmation that requested metrics are aggregate and non-customer-specific",
      "owner": "Data/Analytics",
      "unblocks": "read-only analytics validation"
    }
  ],
  "mode": "offline_deterministic",
  "next_validation": {
    "action": "Run a read-only analytics validation with named datasets, dashboards, and aggregate-only metrics.",
    "owner": "Data/Analytics + Engineering",
    "success_criteria": [
      "dataset and dashboard allowlist approved",
      "read-only credentials verified",
      "no row export or dashboard mutation allowed",
      "audit log owner named"
    ]
  },
  "packet_id": "ia-agent-access-read-only-analytics-v0",
  "requested_capability": [
    {
      "default_demo_state": "dry_run_only",
      "requested_access": "read aggregate product usage tables",
      "risk_level": "low",
      "system": "BigQuery"
    },
    {
      "default_demo_state": "dry_run_only",
      "requested_access": "read dashboards and saved explores",
      "risk_level": "low",
      "system": "Looker"
    }
  ],
  "reviewer_action_items": [
    {
      "action": "Confirm metrics are aggregate, allowlisted, and non-customer-specific",
      "blocks": "read-only analytics validation",
      "owner": "Data/Analytics"
    },
    {
      "action": "Provide read-only credential proof and audit log owner",
      "blocks": "warehouse/dashboard connection",
      "owner": "Engineering"
    }
  ],
  "reviewer_owners": [
    {
      "current_state": "required_before_validation",
      "owner": "Data/Analytics",
      "review_area": "aggregate metric scope, dashboard allowlist, read-only credentials"
    },
    {
      "current_state": "required_before_access",
      "owner": "Engineering",
      "review_area": "read-only credential boundary and audit log owner"
    }
  ],
  "safety_state": {
    "approval_granted": false,
    "composio_dry_run": true,
    "default_public_demo_posture": "review_packet_only",
    "external_writes_enabled": false,
    "packet_state_mutation": false,
    "requires_human_approval": true
  },
  "schema_version": "decision_packet.v0",
  "source_status": {
    "deterministic_packet": "generated",
    "live_vendor_evidence": "not_fetched_in_offline_mode",
    "reviewer_confirmation": "missing",
    "tool_auth_state": "not_connected_in_offline_mode",
    "user_prompt": "provided",
    "workspace_policy": "missing"
  },
  "tool_access_plan": {
    "bigquery": {
      "blocked_actions": [
        "writes",
        "exports",
        "permission changes"
      ],
      "demo_allowance": "read-only validation plan only",
      "requested": "read aggregate product usage tables",
      "required_proof": [
        "dataset/resource allowlist",
        "data owner approval",
        "read-only credential proof"
      ]
    },
    "looker": {
      "blocked_actions": [
        "writes",
        "exports",
        "permission changes"
      ],
      "demo_allowance": "read-only validation plan only",
      "requested": "read dashboards and saved explores",
      "required_proof": [
        "dataset/resource allowlist",
        "data owner approval",
        "read-only credential proof"
      ]
    }
  },
  "tool_scope": {
    "bigquery": {
      "blocked_until_proven": [
        "permission changes",
        "data export",
        "workspace-wide access"
      ],
      "read": [
        "datasets.read",
        "jobs.create_read_only_query"
      ],
      "write": []
    },
    "looker": {
      "blocked_until_proven": [
        "permission changes",
        "data export",
        "workspace-wide access"
      ],
      "read": [
        "dashboards.read",
        "explores.read"
      ],
      "write": []
    }
  }
}
